{
  "$schema": "https://json-schema.org/draft/2020-12/schema",
  "title": "Novel Reader Book",
  "type": "object",
  "additionalProperties": false,
  "required": [
    "schemaVersion",
    "id",
    "title",
    "author",
    "source",
    "chapters"
  ],
  "properties": {
    "schemaVersion": {
      "type": "string",
      "const": "0.1"
    },
    "id": {
      "type": "string",
      "minLength": 1
    },
    "title": {
      "type": "string",
      "minLength": 1
    },
    "author": {
      "type": "string"
    },
    "source": {
      "type": "object",
      "additionalProperties": false,
      "required": ["site", "url"],
      "properties": {
        "site": {
          "type": "string",
          "minLength": 1
        },
        "url": {
          "type": "string",
          "format": "uri"
        }
      }
    },
    "chapters": {
      "type": "array",
      "minItems": 1,
      "items": {
        "type": "object",
        "additionalProperties": false,
        "required": ["id", "title", "body"],
        "properties": {
          "id": {
            "type": "string",
            "minLength": 1
          },
          "title": {
            "type": "string"
          },
          "body": {
            "type": "string"
          }
        }
      }
    }
  }
}
